{
  "schema_version": "1.0.0",
  "schema_ref": "draft_shard.schema.json",
  "draft_status": "UNVERIFIED",
  "case_type": "long_doc_localization",
  "expected_case_count": 10,
  "cases": [
    {
      "case_id": "rw-gold-v1-long-bge-query-instruction",
      "tier": "CORE",
      "case_type": "long_doc_localization",
      "information_need_key": "long-bge-query-instruction",
      "question": "BGE-M3 用于 embedding retrieval 时，相比普通 BGE，query 预处理上有什么唯一差异？",
      "query_language": "zh-CN",
      "expected_answer_language": "zh-CN",
      "primary_topic": "rag_retrieval",
      "secondary_topics": [],
      "difficulty": "hard",
      "answerable": true,
      "localization_region": "middle",
      "evidence_groups": [
        {
          "evidence_group_id": "eg-rw-long-bge-query-instruction-01",
          "required": true,
          "evidence_role": "REQUIRED",
          "any_of_document_ids": [
            "rw-rag-bge-m3"
          ],
          "any_of_evidence_ids": [
            "ev-rw-bge-no-query-instruction"
          ],
          "notes": "AND across required groups; OR within this group's stable source anchors."
        }
      ],
      "acceptable_supporting_evidence": [],
      "plausible_distractor_documents": [],
      "claims": [
        {
          "claim_id": "rw-gold-v1-long-bge-query-instruction-claim-01",
          "canonical_claim": "BGE-M3 no longer requires adding instructions to queries.",
          "required": true,
          "evaluation_mode": "SEMANTIC_REVIEW",
          "evidence_group_ids": [
            "eg-rw-long-bge-query-instruction-01"
          ],
          "notes": "Atomic claim; judge against the referenced stable evidence groups."
        }
      ],
      "citation_contract": {
        "citation_required": true,
        "required_evidence_group_ids": [
          "eg-rw-long-bge-query-instruction-01"
        ],
        "minimum_distinct_required_documents": 1,
        "acceptable_support_policy": "ALLOW_GENUINE_SUPPORT",
        "forbid_citations": false,
        "notes": "Citations must semantically support each attached claim and cover every required group."
      }
    },
    {
      "case_id": "rw-gold-v1-long-bge-score-mix",
      "tier": "CORE",
      "case_type": "long_doc_localization",
      "information_need_key": "long-bge-score-mix",
      "question": "BGE-M3 文档的 text-pair 评分示例如何把 dense、sparse 和 ColBERT 三种得分组合起来？",
      "query_language": "zh-CN",
      "expected_answer_language": "zh-CN",
      "primary_topic": "rag_retrieval",
      "secondary_topics": [],
      "difficulty": "hard",
      "answerable": true,
      "localization_region": "deep",
      "evidence_groups": [
        {
          "evidence_group_id": "eg-rw-long-bge-score-mix-01",
          "required": true,
          "evidence_role": "REQUIRED",
          "any_of_document_ids": [
            "rw-rag-bge-m3"
          ],
          "any_of_evidence_ids": [
            "ev-rw-bge-score-weights"
          ],
          "notes": "AND across required groups; OR within this group's stable source anchors."
        }
      ],
      "acceptable_supporting_evidence": [],
      "plausible_distractor_documents": [],
      "claims": [
        {
          "claim_id": "rw-gold-v1-long-bge-score-mix-claim-01",
          "canonical_claim": "compute_score accepts weights_for_different_modes and forms a weighted sum of dense, sparse, and ColBERT scores.",
          "required": true,
          "evaluation_mode": "SEMANTIC_REVIEW",
          "evidence_group_ids": [
            "eg-rw-long-bge-score-mix-01"
          ],
          "notes": "Atomic claim; judge against the referenced stable evidence groups."
        },
        {
          "claim_id": "rw-gold-v1-long-bge-score-mix-claim-02",
          "canonical_claim": "The shown weights are 0.4, 0.2, and 0.4.",
          "required": true,
          "evaluation_mode": "STRUCTURED_EXACT",
          "evidence_group_ids": [
            "eg-rw-long-bge-score-mix-01"
          ],
          "notes": "Atomic claim; judge against the referenced stable evidence groups.",
          "deterministic_match": {
            "all_terms": [
              "0.4",
              "0.2"
            ]
          }
        }
      ],
      "citation_contract": {
        "citation_required": true,
        "required_evidence_group_ids": [
          "eg-rw-long-bge-score-mix-01"
        ],
        "minimum_distinct_required_documents": 1,
        "acceptable_support_policy": "ALLOW_GENUINE_SUPPORT",
        "forbid_citations": false,
        "notes": "Citations must semantically support each attached claim and cover every required group."
      }
    },
    {
      "case_id": "rw-gold-v1-long-bge-training",
      "tier": "CORE",
      "case_type": "long_doc_localization",
      "information_need_key": "long-bge-training",
      "question": "BGE-M3 的训练部分怎样同时处理多检索模式监督、长文本批处理效率和资源不足时的长文本能力？",
      "query_language": "zh-CN",
      "expected_answer_language": "zh-CN",
      "primary_topic": "rag_retrieval",
      "secondary_topics": [],
      "difficulty": "hard",
      "answerable": true,
      "localization_region": "deep",
      "evidence_groups": [
        {
          "evidence_group_id": "eg-rw-long-bge-training-01",
          "required": true,
          "evidence_role": "REQUIRED",
          "any_of_document_ids": [
            "rw-rag-bge-m3"
          ],
          "any_of_evidence_ids": [
            "ev-rw-bge-training"
          ],
          "notes": "AND across required groups; OR within this group's stable source anchors."
        }
      ],
      "acceptable_supporting_evidence": [],
      "plausible_distractor_documents": [],
      "claims": [
        {
          "claim_id": "rw-gold-v1-long-bge-training-claim-01",
          "canonical_claim": "Self-knowledge distillation combines outputs from multiple retrieval modes as reward signals.",
          "required": true,
          "evaluation_mode": "SEMANTIC_REVIEW",
          "evidence_group_ids": [
            "eg-rw-long-bge-training-01"
          ],
          "notes": "Atomic claim; judge against the referenced stable evidence groups."
        },
        {
          "claim_id": "rw-gold-v1-long-bge-training-claim-02",
          "canonical_claim": "Efficient batching targets long-text fine-tuning efficiency.",
          "required": true,
          "evaluation_mode": "SEMANTIC_REVIEW",
          "evidence_group_ids": [
            "eg-rw-long-bge-training-01"
          ],
          "notes": "Atomic claim; judge against the referenced stable evidence groups."
        },
        {
          "claim_id": "rw-gold-v1-long-bge-training-claim-03",
          "canonical_claim": "MCLS improves long-text performance without fine-tuning when resources are insufficient.",
          "required": true,
          "evaluation_mode": "SEMANTIC_REVIEW",
          "evidence_group_ids": [
            "eg-rw-long-bge-training-01"
          ],
          "notes": "Atomic claim; judge against the referenced stable evidence groups."
        }
      ],
      "citation_contract": {
        "citation_required": true,
        "required_evidence_group_ids": [
          "eg-rw-long-bge-training-01"
        ],
        "minimum_distinct_required_documents": 1,
        "acceptable_support_policy": "ALLOW_GENUINE_SUPPORT",
        "forbid_citations": false,
        "notes": "Citations must semantically support each attached claim and cover every required group."
      }
    },
    {
      "case_id": "rw-gold-v1-long-langgraph-positioning",
      "tier": "CORE",
      "case_type": "long_doc_localization",
      "information_need_key": "long-langgraph-positioning",
      "question": "LangGraph 在长文档开头如何定位自身：它面向哪类 agent，又强调给开发者哪两类底层控制？",
      "query_language": "zh-CN",
      "expected_answer_language": "zh-CN",
      "primary_topic": "agent_engineering",
      "secondary_topics": [],
      "difficulty": "hard",
      "answerable": true,
      "localization_region": "early",
      "evidence_groups": [
        {
          "evidence_group_id": "eg-rw-long-langgraph-positioning-01",
          "required": true,
          "evidence_role": "REQUIRED",
          "any_of_document_ids": [
            "rw-agent-langgraph-overview"
          ],
          "any_of_evidence_ids": [
            "ev-rw-agent-overview-purpose"
          ],
          "notes": "AND across required groups; OR within this group's stable source anchors."
        },
        {
          "evidence_group_id": "eg-rw-long-langgraph-positioning-02",
          "required": true,
          "evidence_role": "REQUIRED",
          "any_of_document_ids": [
            "rw-agent-langgraph-overview"
          ],
          "any_of_evidence_ids": [
            "ev-rw-agent-overview-capabilities"
          ],
          "notes": "AND across required groups; OR within this group's stable source anchors."
        }
      ],
      "acceptable_supporting_evidence": [],
      "plausible_distractor_documents": [],
      "claims": [
        {
          "claim_id": "rw-gold-v1-long-langgraph-positioning-claim-01",
          "canonical_claim": "LangGraph positions itself as a low-level orchestration framework for long-running, stateful agents.",
          "required": true,
          "evaluation_mode": "SEMANTIC_REVIEW",
          "evidence_group_ids": [
            "eg-rw-long-langgraph-positioning-01"
          ],
          "notes": "Atomic claim; judge against the referenced stable evidence groups."
        },
        {
          "claim_id": "rw-gold-v1-long-langgraph-positioning-claim-02",
          "canonical_claim": "It emphasizes control over both agent workflows and agent state.",
          "required": true,
          "evaluation_mode": "SEMANTIC_REVIEW",
          "evidence_group_ids": [
            "eg-rw-long-langgraph-positioning-01",
            "eg-rw-long-langgraph-positioning-02"
          ],
          "notes": "Atomic claim; judge against the referenced stable evidence groups."
        }
      ],
      "citation_contract": {